{"authority_id":"authority-37083931810","command_id":"relay-dev-loop-133-signal-active-proof-2","correlation_id":"signal-active-proof-2","event_type":"ACQUIRE","expected_pr":264,"expected_repo":"kamiyusense/multi-ai-council-phase0","expected_target_head":"151575ed03a1c2c4f528fbcf8b11ededc3202bd9","expires_at":"2026-10-03T01:40:02+00:00","fencing_token":1,"generation":1,"grant_state":"GRANTED","holder_id":"chatgpt-controller","issued_at":"2026-10-03T00:53:31Z","loop_id":"chatgpt-semi-auto","owner_role":"SEMI_AUTO","previous_generation":null,"schema_version":1,"verification_ref":"automation/command_bus/evidence/chatgpt-semi-auto/authority-37083931810.json"}